{
  "$schema": "https://json-schema.org/draft/2020-12/schema",
  "type": "object",
  "properties": {
    "versao": {
      "type": "number",
      "const": 1
    },
    "blocos": {
      "maxItems": 6,
      "type": "array",
      "items": {
        "type": "string",
        "enum": [
          "horarios",
          "precos",
          "avisos",
          "servicos",
          "contactos",
          "faq"
        ]
      }
    },
    "horarios": {
      "default": [],
      "maxItems": 12,
      "type": "array",
      "items": {
        "type": "object",
        "properties": {
          "id": {
            "type": "string",
            "maxLength": 64,
            "pattern": "^[a-z0-9]+(?:-[a-z0-9]+)*$"
          },
          "nome": {
            "type": "string",
            "minLength": 1,
            "maxLength": 80
          },
          "tipo": {
            "type": "string",
            "enum": [
              "opening",
              "availability",
              "classes"
            ]
          }
        },
        "required": [
          "id",
          "nome",
          "tipo"
        ],
        "additionalProperties": false
      }
    },
    "conteudo": {
      "type": "object",
      "properties": {
        "horarios": {
          "type": "object",
          "propertyNames": {
            "type": "string",
            "maxLength": 64,
            "pattern": "^[a-z0-9]+(?:-[a-z0-9]+)*$"
          },
          "additionalProperties": {
            "anyOf": [
              {
                "type": "object",
                "properties": {
                  "dias": {
                    "maxItems": 7,
                    "type": "array",
                    "items": {
                      "type": "object",
                      "properties": {
                        "dia": {
                          "type": "integer",
                          "minimum": 1,
                          "maximum": 7
                        },
                        "intervalos": {
                          "maxItems": 6,
                          "type": "array",
                          "items": {
                            "type": "object",
                            "properties": {
                              "inicio": {
                                "type": "string",
                                "pattern": "^([01]\\d|2[0-3]):[0-5]\\d$"
                              },
                              "fim": {
                                "type": "string",
                                "pattern": "^([01]\\d|2[0-3]):[0-5]\\d$"
                              }
                            },
                            "required": [
                              "inicio",
                              "fim"
                            ],
                            "additionalProperties": false
                          }
                        }
                      },
                      "required": [
                        "dia",
                        "intervalos"
                      ],
                      "additionalProperties": false
                    }
                  },
                  "excecoes": {
                    "maxItems": 200,
                    "type": "array",
                    "items": {
                      "type": "object",
                      "properties": {
                        "data": {
                          "type": "string",
                          "pattern": "^\\d{4}-\\d{2}-\\d{2}$"
                        },
                        "fechado": {
                          "type": "boolean"
                        },
                        "inicio": {
                          "type": "string",
                          "pattern": "^([01]\\d|2[0-3]):[0-5]\\d$"
                        },
                        "fim": {
                          "type": "string",
                          "pattern": "^([01]\\d|2[0-3]):[0-5]\\d$"
                        },
                        "nota": {
                          "type": "string",
                          "minLength": 1,
                          "maxLength": 200
                        }
                      },
                      "required": [
                        "data",
                        "fechado"
                      ],
                      "additionalProperties": false
                    }
                  }
                },
                "required": [
                  "dias",
                  "excecoes"
                ],
                "additionalProperties": false
              },
              {
                "type": "object",
                "properties": {
                  "aulas": {
                    "maxItems": 300,
                    "type": "array",
                    "items": {
                      "type": "object",
                      "properties": {
                        "id": {
                          "type": "string",
                          "maxLength": 64,
                          "pattern": "^[a-z0-9]+(?:-[a-z0-9]+)*$"
                        },
                        "dia": {
                          "type": "integer",
                          "minimum": 1,
                          "maximum": 7
                        },
                        "inicio": {
                          "type": "string",
                          "pattern": "^([01]\\d|2[0-3]):[0-5]\\d$"
                        },
                        "fim": {
                          "type": "string",
                          "pattern": "^([01]\\d|2[0-3]):[0-5]\\d$"
                        },
                        "modalidade": {
                          "type": "string",
                          "minLength": 1,
                          "maxLength": 80
                        },
                        "instrutor": {
                          "type": "string",
                          "minLength": 1,
                          "maxLength": 80
                        },
                        "sala": {
                          "type": "string",
                          "minLength": 1,
                          "maxLength": 80
                        },
                        "nivel": {
                          "type": "string",
                          "enum": [
                            "iniciação",
                            "intermédio",
                            "avançado",
                            "todos"
                          ]
                        },
                        "lotacao": {
                          "type": "integer",
                          "minimum": 1,
                          "maximum": 1000
                        },
                        "visivel": {
                          "type": "boolean"
                        }
                      },
                      "required": [
                        "id",
                        "dia",
                        "inicio",
                        "fim",
                        "modalidade",
                        "visivel"
                      ],
                      "additionalProperties": false
                    }
                  },
                  "excecoes": {
                    "maxItems": 200,
                    "type": "array",
                    "items": {
                      "type": "object",
                      "properties": {
                        "data": {
                          "type": "string",
                          "pattern": "^\\d{4}-\\d{2}-\\d{2}$"
                        },
                        "fechado": {
                          "type": "boolean"
                        },
                        "inicio": {
                          "type": "string",
                          "pattern": "^([01]\\d|2[0-3]):[0-5]\\d$"
                        },
                        "fim": {
                          "type": "string",
                          "pattern": "^([01]\\d|2[0-3]):[0-5]\\d$"
                        },
                        "nota": {
                          "type": "string",
                          "minLength": 1,
                          "maxLength": 200
                        }
                      },
                      "required": [
                        "data",
                        "fechado"
                      ],
                      "additionalProperties": false
                    }
                  }
                },
                "required": [
                  "aulas",
                  "excecoes"
                ],
                "additionalProperties": false
              }
            ]
          }
        },
        "precos": {
          "maxItems": 60,
          "type": "array",
          "items": {
            "type": "object",
            "properties": {
              "id": {
                "type": "string",
                "maxLength": 64,
                "pattern": "^[a-z0-9]+(?:-[a-z0-9]+)*$"
              },
              "nome": {
                "type": "string",
                "minLength": 1,
                "maxLength": 120
              },
              "preco": {
                "type": "number",
                "minimum": 0,
                "maximum": 100000
              },
              "periodo": {
                "type": "string",
                "minLength": 1,
                "maxLength": 40
              },
              "inclui": {
                "maxItems": 20,
                "type": "array",
                "items": {
                  "type": "string",
                  "minLength": 1,
                  "maxLength": 160
                }
              },
              "destaque": {
                "type": "boolean"
              },
              "visivel": {
                "type": "boolean"
              }
            },
            "required": [
              "id",
              "nome",
              "preco",
              "visivel"
            ],
            "additionalProperties": false
          }
        },
        "avisos": {
          "maxItems": 40,
          "type": "array",
          "items": {
            "type": "object",
            "properties": {
              "id": {
                "type": "string",
                "maxLength": 64,
                "pattern": "^[a-z0-9]+(?:-[a-z0-9]+)*$"
              },
              "texto": {
                "type": "string",
                "minLength": 1,
                "maxLength": 400
              },
              "inicio": {
                "type": "string",
                "pattern": "^\\d{4}-\\d{2}-\\d{2}$"
              },
              "fim": {
                "type": "string",
                "pattern": "^\\d{4}-\\d{2}-\\d{2}$"
              },
              "visivel": {
                "type": "boolean"
              }
            },
            "required": [
              "id",
              "texto",
              "inicio",
              "fim",
              "visivel"
            ],
            "additionalProperties": false
          }
        },
        "servicos": {
          "maxItems": 80,
          "type": "array",
          "items": {
            "type": "object",
            "properties": {
              "id": {
                "type": "string",
                "maxLength": 64,
                "pattern": "^[a-z0-9]+(?:-[a-z0-9]+)*$"
              },
              "nome": {
                "type": "string",
                "minLength": 1,
                "maxLength": 120
              },
              "descricao": {
                "type": "string",
                "minLength": 1,
                "maxLength": 600
              },
              "duracao": {
                "type": "integer",
                "minimum": 1,
                "maximum": 1440
              },
              "preco": {
                "type": "number",
                "minimum": 0,
                "maximum": 100000
              },
              "foto": {
                "type": "string",
                "maxLength": 200,
                "pattern": "^\\/[A-Za-z0-9/_.-]+\\.(webp|avif|jpg|jpeg|png)$"
              },
              "visivel": {
                "type": "boolean"
              }
            },
            "required": [
              "id",
              "nome",
              "visivel"
            ],
            "additionalProperties": false
          }
        },
        "contactos": {
          "type": "object",
          "properties": {
            "telefone": {
              "type": "string",
              "minLength": 1,
              "maxLength": 30
            },
            "whatsapp": {
              "type": "string",
              "pattern": "^\\d{8,15}$"
            },
            "email": {
              "type": "string",
              "maxLength": 200,
              "format": "email",
              "pattern": "^(?:[A-Za-z0-9_'+\\-]+\\.)*[A-Za-z0-9_'+\\-]*[A-Za-z0-9_+-]@(?:[A-Za-z0-9][A-Za-z0-9\\-]*\\.)+[A-Za-z]{2,}$"
            },
            "morada": {
              "type": "string",
              "minLength": 1,
              "maxLength": 300
            },
            "redes": {
              "maxItems": 12,
              "type": "array",
              "items": {
                "type": "object",
                "properties": {
                  "tipo": {
                    "type": "string",
                    "minLength": 1,
                    "maxLength": 40
                  },
                  "url": {
                    "type": "string",
                    "maxLength": 300,
                    "format": "uri"
                  }
                },
                "required": [
                  "tipo",
                  "url"
                ],
                "additionalProperties": false
              }
            }
          },
          "additionalProperties": false
        },
        "faq": {
          "maxItems": 60,
          "type": "array",
          "items": {
            "type": "object",
            "properties": {
              "id": {
                "type": "string",
                "maxLength": 64,
                "pattern": "^[a-z0-9]+(?:-[a-z0-9]+)*$"
              },
              "pergunta": {
                "type": "string",
                "minLength": 1,
                "maxLength": 200
              },
              "resposta": {
                "type": "string",
                "minLength": 1,
                "maxLength": 1200
              },
              "visivel": {
                "type": "boolean"
              }
            },
            "required": [
              "id",
              "pergunta",
              "resposta",
              "visivel"
            ],
            "additionalProperties": false
          }
        }
      },
      "additionalProperties": false
    }
  },
  "required": [
    "versao",
    "blocos",
    "horarios",
    "conteudo"
  ],
  "additionalProperties": false,
  "title": "mova.json (versão 1)"
}
