{
  "versao": 1,
  "blocos": ["horarios", "servicos", "contactos"],
  "horarios": [
    { "id": "clinica", "nome": "Clínica", "tipo": "opening" },
    { "id": "consultas", "nome": "Consultas de fisioterapia", "tipo": "availability" }
  ],
  "conteudo": {
    "horarios": {
      "clinica": {
        "dias": [
          { "dia": 1, "intervalos": [{ "inicio": "09:00", "fim": "19:00" }] },
          { "dia": 2, "intervalos": [{ "inicio": "09:00", "fim": "19:00" }] },
          { "dia": 6, "intervalos": [{ "inicio": "09:00", "fim": "13:00" }] }
        ],
        "excecoes": []
      },
      "consultas": {
        "dias": [
          { "dia": 1, "intervalos": [{ "inicio": "09:00", "fim": "12:30" }, { "inicio": "14:00", "fim": "18:00" }] }
        ],
        "excecoes": [{ "data": "2026-11-02", "fechado": false, "inicio": "09:00", "fim": "12:00", "nota": "Só de manhã" }]
      }
    },
    "servicos": [
      { "id": "fisioterapia", "nome": "Fisioterapia", "duracao": 45, "visivel": true },
      { "id": "massagem", "nome": "Massagem terapêutica", "preco": 35, "visivel": true }
    ],
    "contactos": { "telefone": "+351 256 000 000", "email": "geral@exemplo.pt" }
  }
}
